Author,Headline,Keywords,Topics,URL,Outlet,Timestamp
Chandrima Banerjee,Comet vs Atlas vs Chrome: We tested two AI browsers. Hereâs what we found,"Comet, Atlas, Chrome, Tested, Browsers, What, Found",Technology,https://timesofindia.indiatimes.com/toi-plus/technology/comet-vs-atlas-vs-chrome-we-tested-two-ai-browsers-heres-what-we-found/articleshow/124825565.cms,TOI,2025-10-26 17:18:24
Neeraj Dhankher,"Virgo Weekly Shani Horoscope, October 27 â November 2, 2025: Saturn tests loyalty, keep the promise you made first","Virgo Weekly Shani Horoscope, October, November, Saturn, Tests, Loyalty, Keep, Promise, Made, First",General,https://timesofindia.indiatimes.com/astrology/horoscope/virgo-weekly-shani-horoscope-october-27-november-2-2025-saturn-tests-loyalty-keep-the-promise-you-made-first/articleshow/124786249.cms,TOI,2025-10-26 17:18:24
Riya Sharma,When wanderlust goes viral: Social feeds & shows are shaping travel trends,"When, Wanderlust, Goes, Viral, Social, Feeds, Shows, Shaping, Travel, Trends",Entertainment,https://timesofindia.indiatimes.com/life-style/spotlight/when-wanderlust-goes-viral-social-feeds-shows-are-shaping-travel-trends/articleshow/124826093.cms,TOI,2025-10-26 17:18:24
Rashmi Drolia,PM Narendra Modi praises Chhattisgarhâs âGarbage CafÃ©â initiative in Mann Ki Baat,"Narendra Modi, Praises, Garbage, Initiative, Mann Ki Baat",Technology,https://timesofindia.indiatimes.com/city/raipur/pm-narendra-modi-praises-chhattisgarhs-garbage-caf-initiative-in-mann-ki-baat/articleshow/124826196.cms,TOI,2025-10-26 17:18:24
TOI Sports Desk,Karun Nair sends strong message to India selectors with unbeaten Ranji Trophy knock,"Karun Nair, Sends, Strong, Message, India, Selectors, Unbeaten, Ranji Trophy, Knock",Technology,https://timesofindia.indiatimes.com/sports/cricket/news/karun-nair-sends-strong-message-to-india-selectors-with-ranji-trophy-knock/articleshow/124826139.cms,TOI,2025-10-26 17:18:24
TOI Entertainment Desk,Did You Know? Salman Khan had tears in his eyes while shooting for 'Maine Pyar Kiya'! Deets inside!,"Did You Know, Salman Khan, Tears, Eyes, While, Shooting, Maine Pyar Kiya, Deets, Inside",Technology,https://timesofindia.indiatimes.com/entertainment/hindi/bollywood/news/did-you-know-salman-khan-had-tears-in-his-eyes-while-shooting-for-maine-pyar-kiya-deets-inside/articleshow/124826230.cms,TOI,2025-10-26 17:18:25
TOI Lifestyle Desk,"Obesity can damage your skin: Why dark patches, infections, and psoriasis are warning signs","Obesity, Damage, Your, Skin, Dark, Patches, Infections, Psoriasis, Warning, Signs",International,https://timesofindia.indiatimes.com/life-style/health-fitness/health-news/obesity-can-damage-your-skin-why-dark-patches-infections-and-psoriasis-are-warning-signs/articleshow/124825536.cms,TOI,2025-10-26 17:18:25
TOI Entertainment Desk,"Nithya Menen shares poetic BTS moments, shares an untold story from National Award win","Shares, Nithya Menen, Poetic, Moments, Untold, Story, National Award",International,https://timesofindia.indiatimes.com/entertainment/tamil/movies/news/nithya-menen-shares-poetic-bts-moments-shares-an-untold-story-from-national-award-win/articleshow/124825642.cms,TOI,2025-10-26 17:18:25
TOI Business Desk,"FMCG sales dip: GST changes, heavy rains hit Q3 demand; global majors stay bullish on India growth","Sales, Changes, Heavy, Rains, Demand, Global, Majors, Stay, Bullish, India","International, Technology",https://timesofindia.indiatimes.com/business/india-business/fmcg-sales-dip-gst-changes-heavy-rains-hit-q3-demand-global-majors-stay-bullish-on-india-growth/articleshow/124825380.cms,TOI,2025-10-26 17:18:25
TOI Entertainment Desk,"'Satish Shah, better dead than aliveâ: When the actor recalled playing a dead body in âJaane Bhi Do Yaaroâ","Dead, Satish Shah, Better, Than, When, Actor, Recalled, Playing, Body, Jaane Bhi Do",Entertainment,https://timesofindia.indiatimes.com/entertainment/hindi/bollywood/news/satish-shah-better-dead-than-alive-when-the-actor-recalled-playing-a-dead-body-in-jaane-bhi-do-yaaro/articleshow/124825672.cms,TOI,2025-10-26 17:18:26
TOI Entertainment Desk,Dilip Prabhavalkar's âDashavatarâ now in Malayalam; Subodh Khanolkar's film to release on November 21 in this new version,"Dilip Prabhavalkar, Malayalam, Subodh Khanolkar, Film, Release, November, Version",Entertainment,https://timesofindia.indiatimes.com/entertainment/marathi/movies/news/dilip-prabhavalkars-dashavatar-now-in-malayalam-subodh-khanolkars-film-to-release-on-november-21-in-this-new-version/articleshow/124825713.cms,TOI,2025-10-26 17:18:26
TOI Lifestyle Desk,Who knew Sonam Bajwa in chic white saree could make minimalism look this hot,"Knew, Sonam Bajwa, Chic, White, Saree, Make, Minimalism, Look",General,https://timesofindia.indiatimes.com/life-style/fashion/celeb-style/who-knew-sonam-bajwa-in-chic-white-saree-could-make-minimalism-look-this-hot/articleshow/124825641.cms,TOI,2025-10-26 17:18:26
Sidhharrth S Kumaar,"Weekly Love Horoscope Predictions, October 26 to November 01, 2025: Your zodiac love forecast for this week","Weekly Love Horoscope Predictions, October, November, Your, Zodiac, Love, Forecast, Week",General,https://timesofindia.indiatimes.com/astrology/horoscope/weekly-love-horoscope-predictions-october-26-to-november-01-2025-your-zodiac-love-forecast-for-this-week/articleshow/124825515.cms,TOI,2025-10-26 17:18:26
Sidhharrth S Kumaar,Lucky numbers for October 26 to November 01: Your weekly fortunate number revealed,"Lucky, Numbers, October, November, Your, Weekly, Fortunate, Number, Revealed",General,https://timesofindia.indiatimes.com/astrology/numerology-tarot/lucky-numbers-for-october-26-to-november-01-your-weekly-fortunate-number-revealed/articleshow/124825703.cms,TOI,2025-10-26 17:18:26
TOI Entertainment Desk,"âBoth Dhanush and Karthi are not available..â Selvaraghavan on the sequels of âPudhupettaiâ, and âAayirathil Oruvanâ","Both Dhanush, Karthi, Available, Selvaraghavan, Sequels, Aayirathil",Technology,https://timesofindia.indiatimes.com/entertainment/tamil/movies/news/both-dhanush-and-karthi-are-not-available-selvaraghavan-on-the-sequels-of-pudhupettai-and-aayirathil-oruvan/articleshow/124825745.cms,TOI,2025-10-26 17:18:27
TOI Sports Desk,Riyan Parag shines in record-shortest Ranji Trophy match in 63 years,"Riyan Parag, Shines, Record, Shortest, Ranji Trophy, Match, Years",Sports,https://timesofindia.indiatimes.com/sports/cricket/news/riyan-parag-shines-in-record-shortest-ranji-trophy-match-in-63-years/articleshow/124825533.cms,TOI,2025-10-26 17:18:27
TOI Sports Desk,How much does Sara Tendulkar earn from Instagram? Shocking income of Sachinâs daughter revealed,"Much, Sara Tendulkar, Earn, Instagram, Shocking, Income, Daughter, Revealed",General,https://timesofindia.indiatimes.com/sports/off-the-field/how-much-does-sara-tendulkar-earn-from-instagram-shocking-income-of-sachins-daughter-revealed/articleshow/124825826.cms,TOI,2025-10-26 17:18:27
Sushmita Jha,Fragrances become an essential part of festive home celebrations,"Fragrances, Become, Essential, Part, Festive, Home, Celebrations",General,https://timesofindia.indiatimes.com/life-style/home-garden/fragrances-become-an-essential-part-of-festive-home-celebrations/articleshow/124784161.cms,TOI,2025-10-26 17:18:27
TOI Lifestyle Desk,"How to explore Gangtok like a local, and on a shoestring budget?","Explore, Gangtok, Like, Local, Shoestring, Budget",General,https://timesofindia.indiatimes.com/life-style/travel/how-to-explore-gangtok-like-a-local-and-on-a-shoestring-budget/articleshow/124825817.cms,TOI,2025-10-26 17:18:27
Neeraj Dhankher,"Leo Weekly Shani Horoscope, October 27 â November 2, 2025: Saturn corners procrastination, start now or lose the slot","Leo Weekly Shani Horoscope, October, November, Saturn, Corners, Procrastination, Start, Lose, Slot",International,https://timesofindia.indiatimes.com/astrology/horoscope/leo-weekly-shani-horoscope-october-27-november-2-2025-saturn-corners-procrastination-start-now-or-lose-the-slot/articleshow/124786191.cms,TOI,2025-10-26 17:18:27
TOI News Desk,Bihar polls: Congress to launch campaign after Chhath Puja; set to address ticket distribution allegations,"Bihar, Polls, Congress, Launch, Campaign, After, Chhath Puja, Address, Ticket, Distribution","Technology, Politics",https://timesofindia.indiatimes.com/india/bihar-polls-congress-to-launch-campaign-after-chhath-puja-set-to-address-ticket-distribution-allegations/articleshow/124825879.cms,TOI,2025-10-26 17:18:27
TOI Trending Desk,Khan Sirâs Patna hospital offers ultra-affordable treatment: Even cheaper than govt hospitals,"Khan, Patna, Hospital, Offers, Ultra, Affordable, Treatment, Even, Cheaper, Than",Health,https://timesofindia.indiatimes.com/etimes/trending/khan-sirs-patna-hospital-offers-ultra-affordable-treatment-even-cheaper-than-govt-hospitals/articleshow/124825548.cms,TOI,2025-10-26 17:18:27
Sidhharrth S Kumaar,"Horoscope Tomorrow, October 27, 2025: Your zodiac insights await","Horoscope Tomorrow, October, Your, Zodiac, Insights, Await",Technology,https://timesofindia.indiatimes.com/astrology/horoscope/horoscope-tomorrow-october-27-2025-your-zodiac-insights-await/articleshow/124825830.cms,TOI,2025-10-26 17:18:28
Edit Profile,"Parenting Tips & Advice, Effective Parenting Skills, Parent Child Relationship & Support | Relationships - Times of India Lifestyle","Parenting Tips, Advice, Effective Parenting Skills, Parent Child Relationship, Support, Relationships, Times, India Lifestyle",General,https://timesofindia.indiatimes.com/life-style/relationships/parenting,TOI,2025-10-26 17:18:32
Edit Profile,Latest Telugu Movies | List of New Telugu Films Releases 2025 | eTimes,"Latest Telugu Movies, List, New Telugu Films Releases",Entertainment,https://timesofindia.indiatimes.com/entertainment/latest-new-movies/telugu-movies,TOI,2025-10-26 17:18:32
Edit Profile,"Hindi TV News: Check Latest News on Hindi TV Shows, TV Celebrities & Hindi TV Serials","Hindi, News, Check Latest News, Shows, Celebrities, Serials",Entertainment,https://timesofindia.indiatimes.com/tv/news/hindi,TOI,2025-10-26 17:18:32
Barsha Dutta,Will Saquon Barkley play against the New York Giants today? Latest injury update on the Philadelphia Eagles' running back,"Will Saquon Barkley, Play, Against, New York Giants, Today, Latest, Injury, Update, Philadelphia Eagles, Running",Technology,https://timesofindia.indiatimes.com/sports/nfl/news/will-saquon-barkley-play-against-the-new-york-giants-today-latest-injury-update-on-the-philadelphia-eagles-running-back/articleshow/124822628.cms,TOI,2025-10-26 17:18:37
TOI Science Desk,"How humans almost vanished from Earth in 70,000 BCE due to volcanic winter and population collapse","Humans, Almost, Vanished, Earth, Volcanic, Winter, Population, Collapse",General,https://timesofindia.indiatimes.com/science/how-humans-almost-vanished-from-earth-in-70000-bce-due-to-volcanic-winter-and-population-collapse/articleshow/124822054.cms,TOI,2025-10-26 17:18:38
TOI Education,UPSC Medical Officer admit card 2025 released at upsc.gov.in: Direct link to download hall tickets here,"Medical Officer, Admit, Card, Released, Upsc, Direct, Link, Download, Hall, Tickets",Health,https://timesofindia.indiatimes.com/education/news/upsc-medical-officer-admit-card-2025-released-at-upsc-gov-in-direct-link-to-download-hall-tickets-here/articleshow/124825341.cms,TOI,2025-10-26 17:18:39
Trisha Tewari,Japanâs first female PM Sanae Takaichi disavows work-life balance: What are the implications of relentless labor on productivity?,"First, Female, Sanae Takaichi, Disavows, Work, Life, Balance, What, Implications, Relentless",Technology,https://timesofindia.indiatimes.com/education/news/japans-first-female-pm-sanae-takaichi-disavows-work-life-balance-what-are-the-implications-of-relentless-labor-on-productivity/articleshow/124825008.cms,TOI,2025-10-26 17:18:39
TOI News Desk,Manâs Rolex seized at Delhi airport; HC provides reliefâ Check how customs rules apply to declaring high-value items,"Rolex, Seized, Delhi, Airport, Provides, Check, Customs, Rules, Apply, Declaring",Technology,https://timesofindia.indiatimes.com/india/mans-rolex-seized-at-delhi-airport-hc-provides-relief-check-how-customs-rules-apply-to-declaring-high-value-items/articleshow/124824864.cms,TOI,2025-10-26 17:18:39
TOI Entertainment Desk,Satish Shah underwent kidney transplant; 'wanted to live for wife Madhu' friend reveals,"Satish Shah, Underwent, Kidney, Transplant, Wanted, Live, Wife, Madhu, Friend, Reveals",General,https://timesofindia.indiatimes.com/entertainment/hindi/bollywood/news/satish-shah-underwent-kidney-transplant-wanted-to-live-for-wife-madhu-friend-reveals/articleshow/124824765.cms,TOI,2025-10-26 17:18:40
TOI Entertainment Desk,"George Clooney recalls working as a driver, being yelled at by Frank Sinatra, and more; Read more","More, George Clooney, Recalls, Working, Driver, Being, Yelled, Frank Sinatra, Read",General,https://timesofindia.indiatimes.com/entertainment/english/hollywood/news/george-clooney-recalls-working-as-a-driver-being-yelled-at-by-frank-sinatra-and-more-read-more/articleshow/124825281.cms,TOI,2025-10-26 17:18:40
Barsha Dutta,Will Jaxson Dart play against the Philadelphia Eagles today? Latest injury update on the New York Giants' quarterback,"Will Jaxson Dart, Play, Against, Philadelphia Eagles, Today, Latest, Injury, Update, New York Giants, Quarterback",Technology,https://timesofindia.indiatimes.com/sports/nfl/news/will-jaxson-dart-play-against-the-philadelphia-eagles-today-latest-injury-update-on-the-new-york-giants-quarterback/articleshow/124822724.cms,TOI,2025-10-26 17:18:40
TOI Tech Desk,"Amazon founder Jeff Bezos predicts: In the next decade, there will be millions ofâ¦","Amazon, Founder, Jeff Bezos, Predicts, Next, Decade, There, Millions",General,https://timesofindia.indiatimes.com/technology/tech-news/amazon-founder-jeff-bezos-predicts-in-the-next-decade-there-will-be-millions-of/articleshow/124825213.cms,TOI,2025-10-26 17:18:40
TOI Entertainment Desk,âNo botox in my faceâ: Hailey Bieber reveals the truth about her cosmetic treatments,"Botox, Hailey Bieber, Reveals, Truth, About, Cosmetic, Treatments","Technology, Health",https://timesofindia.indiatimes.com/entertainment/english/hollywood/news/no-botox-in-my-face-hailey-bieber-reveals-the-truth-about-her-cosmetic-treatments/articleshow/124825125.cms,TOI,2025-10-26 17:18:40
TOI Entertainment Desk,"Singer Miguel says, âItâs a scary timeâ while addressing Donald Trumpâs anti-immigration crackdown","Singer Miguel, Says, Scary, While, Addressing, Donald, Anti, Immigration, Crackdown",General,https://timesofindia.indiatimes.com/entertainment/english/music/news/singer-miguel-says-its-a-scary-time-while-addressing-donald-trumps-anti-immigration-crackdown/articleshow/124825214.cms,TOI,2025-10-26 17:18:40
TOI Lifestyle Desk,Lucifer star Tom Ellis reveals he almost joined Marvelâs The Fantastic Four: First Steps,"Lucifer, Star, Tom Ellis, Reveals, Almost, Joined, The Fantastic Four, First Steps",General,https://timesofindia.indiatimes.com/entertainment/english/hollywood/news/lucifer-star-tom-ellis-reveals-he-almost-joined-marvels-the-fantastic-four-first-steps/articleshow/124825283.cms,TOI,2025-10-26 17:18:40
TOI World Desk,UAE tops global VPN usage with 6 million downloads: But is it legal? What every resident must know,"Tops, Global, Usage, Million, Downloads, Legal, What, Every, Resident, Know",International,https://timesofindia.indiatimes.com/world/middle-east/uae-tops-global-vpn-usage-with-6-million-downloads-but-is-it-legal-what-every-resident-must-know/articleshow/124825022.cms,TOI,2025-10-26 17:18:41
TOI Entertainment Desk,âNobody wants thisâ: Adam Brody says Seth Rogen was âincredibly gregariousâ in the show,"Nobody, Wants, Adam Brody, Says, Seth Rogen, Incredibly, Show",Entertainment,https://timesofindia.indiatimes.com/web-series/news/english/nobody-wants-this-adam-brody-says-seth-rogen-was-incredibly-gregarious-in-the-show/articleshow/124825378.cms,TOI,2025-10-26 17:18:41
TOI Education,"Indiaâs top MBA colleges 2025: IIM Ahmedabad, IIM Bangalore, and ISB shine in global rankings","Colleges, Ahmedabad, Bangalore, Shine, Global, Rankings","Education, International",https://timesofindia.indiatimes.com/education/news/indias-top-mba-colleges-2025-iim-ahmedabad-iim-bangalore-and-isb-shine-in-global-rankings/articleshow/124825086.cms,TOI,2025-10-26 17:18:41
Mahima Roy,Will Myles Garrett play against the New England Patriots today? Latest injury update on the popular Cleveland Browns' defensive end,"Will Myles Garrett, Play, Against, New England Patriots, Today, Latest, Injury, Update, Popular, Cleveland Browns",Technology,https://timesofindia.indiatimes.com/sports/nfl/news/will-myles-garrett-play-against-the-new-england-patriots-today-latest-injury-update-on-the-popular-cleveland-browns-defensive-end/articleshow/124809498.cms,TOI,2025-10-26 17:18:41
Neeraj Dhankher,"Gemini Weekly Shani Horoscope, October 27 â November 2, 2025: Saturn strains stamina, sleep early or burn out","Gemini Weekly Shani Horoscope, October, November, Saturn, Strains, Stamina, Sleep, Early, Burn",Technology,https://timesofindia.indiatimes.com/astrology/horoscope/gemini-weekly-shani-horoscope-october-27-november-2-2025-saturn-strains-stamina-sleep-early-or-burn-out/articleshow/124786015.cms,TOI,2025-10-26 17:18:41
Neeraj Dhankher,"Cancer Weekly Shani Horoscope, October 27 â November 2, 2025: Saturn spotlights reputation, under-promise, over-deliver","Cancer Weekly Shani Horoscope, October, November, Saturn, Spotlights, Reputation, Under, Promise, Over, Deliver",General,https://timesofindia.indiatimes.com/astrology/horoscope/cancer-weekly-shani-horoscope-october-27-november-2-2025-saturn-spotlights-reputation-under-promise-over-deliver/articleshow/124786116.cms,TOI,2025-10-26 17:18:41
TOI Lifestyle Desk,Satish Shah passes away from kidney failure: 7 common causes of the condition,"Satish Shah, Passes, Away, Kidney, Failure, Common, Causes, Condition",Technology,https://timesofindia.indiatimes.com/life-style/health-fitness/health-news/satish-shah-passes-away-from-kidney-failure-7-common-causes-of-the-condition/articleshow/124805351.cms,TOI,2025-10-26 17:18:47
TOI Entertainment Desk,"Park Bom's agency shares health update, fans react: 'She's emotionally unstable...'","Park Bom, Agency, Shares, Health, Update, Fans, React, Emotionally, Unstable",Health,https://timesofindia.indiatimes.com/entertainment/k-pop/music/news/park-boms-agency-shares-health-update-fans-react-shes-emotionally-unstable-/articleshow/124822691.cms,TOI,2025-10-26 17:18:47
Neha Surana,Chennai Open: Maaya Rajeshwaran Revathi looks to make most of wildcard at home,"Chennai Open, Maaya Rajeshwaran Revathi, Looks, Make, Most, Wildcard, Home","International, Technology",https://timesofindia.indiatimes.com/sports/tennis/wta-chennai-open-maaya-rajeshwaran-revathi-looks-to-make-most-of-wildcard-at-home/articleshow/124822668.cms,TOI,2025-10-26 17:18:47
TOI Tech Desk,Why Microsoft CEO Satya Nadella shared Bill Gates' frustration in an internal meeting,"Why Microsoft, Satya Nadella, Shared, Bill Gates, Frustration, Internal, Meeting",General,https://timesofindia.indiatimes.com/technology/tech-news/why-microsoft-ceo-satya-nadella-shared-bill-gates-frustration-in-an-internal-meeting/articleshow/124822698.cms,TOI,2025-10-26 17:18:47
TOI Entertainment Desk,"Ashoke Pandit pays tribute to Satish Shah, âHe used to never encourage talking about hisâ¦â","Ashoke Pandit, Pays, Tribute, Satish Shah, Used, Never, Encourage, Talking, About",General,https://timesofindia.indiatimes.com/entertainment/hindi/bollywood/news/ashoke-pandit-pays-tribute-to-satish-shah-he-used-to-never-encourage-talking-about-his/articleshow/124822666.cms,TOI,2025-10-26 17:18:47
TOI Entertainment Desk,'#VT15' update: Varun Tej joins the Hyderabad schedule of Indo-Korean horror comedy - Report,"Update, Varun Tej, Joins, Hyderabad, Schedule, Indo, Korean, Horror, Comedy, Report",General,https://timesofindia.indiatimes.com/entertainment/telugu/movies/news/vt15-update-varun-tej-joins-the-hyderabad-schedule-of-indo-korean-horror-comedy-report/articleshow/124822650.cms,TOI,2025-10-26 17:18:47
TOI Tech Desk,Telegram CEO Pavel Durov: Happy to buy and donate Louvre Museumâs stolen jewelry; conditions apply,"Telegram, Pavel Durov, Happy, Donate, Louvre, Stolen, Jewelry, Conditions, Apply",Technology,https://timesofindia.indiatimes.com/technology/tech-news/telegram-ceo-pavel-durov-happy-to-buy-and-donate-louvre-museums-stolen-jewelry-conditions-apply/articleshow/124822725.cms,TOI,2025-10-26 17:18:47
Samad Hoque,"Three, including two Nigerian women, held with commercial quantity of MDMA in Gurgaon; drugs factory busted in Delhi","Three, Including, Nigerian, Women, Held, Commercial, Quantity, Gurgaon, Drugs, Factory",Entertainment,https://timesofindia.indiatimes.com/city/gurgaon/three-including-two-nigerian-women-held-with-commercial-quantity-of-mdma-in-gurgaon-drugs-factory-busted-in-delhi/articleshow/124822680.cms,TOI,2025-10-26 17:18:47
Onkar Kulkarni,"Maheka Mirpuri on her association with Karan Johar! Says his personality has changed, has become more subdued","Maheka Mirpuri, Association, Karan Johar, Says, Personality, Changed, Become, More, Subdued",General,https://timesofindia.indiatimes.com/life-style/spotlight/maheka-mirpuri-talks-about-karan-johars-personality-change-at-mcan-charity-gala-in-mumbai/articleshow/124822757.cms,TOI,2025-10-26 17:18:48
TOI Entertainment Desk,'Idli Kadai' OTT release date: When and where can we watch Dhanush's rural drama,"Idli Kadai, Release, Date, When, Where, Watch, Dhanush, Rural, Drama",Technology,https://timesofindia.indiatimes.com/entertainment/tamil/movies/news/idli-kadai-ott-release-date-when-and-where-can-we-watch-dhanushs-rural-drama/articleshow/124822704.cms,TOI,2025-10-26 17:18:48
TOI World Desk,âWe did something people said couldnât be doneâ: Donald Trump oversees signing of âhistoricâ ThailandâCambodia peace deal,"Something, People, Said, Donald Trump, Oversees, Signing, Cambodia, Peace, Deal",Technology,https://timesofindia.indiatimes.com/world/us/we-did-something-people-said-couldnt-be-done-donald-trump-oversees-signing-of-historic-thailandcambodia-peace-deal/articleshow/124821794.cms,TOI,2025-10-26 17:18:49
TOI News Desk,"Allowance hike, pension & more: INDIA blocâs poll promises for ânew Biharâ; perks for Panchayat heads","Allowance, Hike, Pension, More, Poll, Promises, Perks, Panchayat, Heads",General,https://timesofindia.indiatimes.com/india/allowance-hike-pension-more-india-blocs-poll-promises-for-new-bihar-perks-for-panchayat-heads/articleshow/124822502.cms,TOI,2025-10-26 17:18:49
Lakshima Sareen,IIT Kharagpur to admit students for Olympiad and sports achievements: Which other IITs offer non-JEE admission route?,"Kharagpur, Admit, Students, Olympiad, Sports, Achievements, Which, Other, Offer, Admission","Sports, Education",https://timesofindia.indiatimes.com/education/news/iit-kharagpur-to-admit-students-for-olympiad-and-sports-achievements-which-other-iits-offer-non-jee-admission-route/articleshow/124822653.cms,TOI,2025-10-26 17:18:49
TOI Sports Desk,"Former India cricketer drops bombshell on Virat Kohli, compares him to an âold tractor'","Former India, Cricketer, Drops, Bombshell, Virat Kohli, Compares, Tractor","Sports, Entertainment",https://timesofindia.indiatimes.com/sports/cricket/india-vs-australia/former-india-cricketer-drops-bombshell-on-virat-kohli-compares-him-to-an-old-tractor/articleshow/124822754.cms,TOI,2025-10-26 17:18:49
Arnab Lall Seal,SAAF Championships: India wins 7 gold on Day 2,"Championships, India, Wins, Gold",Sports,https://timesofindia.indiatimes.com/sports/more-sports/saaf-championships-india-wins-7-gold-on-day-2/articleshow/124822775.cms,TOI,2025-10-26 17:18:49
Anmol Jain,Mussoorie-based travel writers Hugh & Colleen Gantzer receive lifetime achievement award from Anglo-Indian Association,"Mussoorie, Based, Travel, Writers, Hugh, Colleen Gantzer, Receive, Lifetime, Achievement, Award",International,https://timesofindia.indiatimes.com/city/dehradun/mussoorie-based-travel-writers-hugh-colleen-gantzer-receive-lifetime-achievement-award-from-anglo-indian-association/articleshow/124822767.cms,TOI,2025-10-26 17:18:49
Faiz Rahman Siddiqui,"UP horror: Woman forced into 2 abortions, sexually abused by husband, father-in-law, brother-in-law over male child demand","Horror, Woman, Forced, Into, Abortions, Sexually, Abused, Husband, Father, Brother",Crime,https://timesofindia.indiatimes.com/city/kanpur/up-horror-woman-forced-into-2-abortions-sexually-abused-by-husband-father-in-law-brother-in-law-over-male-child-demand/articleshow/124822710.cms,TOI,2025-10-26 17:18:49
TOI World Desk,"'YMCA' dance, red carpet, and US flags: How Donald Trump was welcomed at Kuala Lumpur airport -watch","Dance, Carpet, Flags, How Donald Trump, Welcomed, Kuala Lumpur, Airport, Watch",Technology,https://timesofindia.indiatimes.com/world/us/ymca-dance-red-carpet-and-us-flags-how-donald-trump-was-welcomed-at-kuala-lumpur-airport-watch/articleshow/124822809.cms,TOI,2025-10-26 17:18:52
TOI Lifestyle Desk,'It changed my marriage': The modern woman is taking testosterone and loving it,"Changed, Marriage, Modern, Woman, Taking, Testosterone, Loving",General,https://timesofindia.indiatimes.com/life-style/health-fitness/health-news/it-changed-my-marriage-the-modern-woman-is-taking-testosterone-and-loving-it/articleshow/124822716.cms,TOI,2025-10-26 17:18:52
