Author,Headline,Keywords,Topics,URL,Outlet,Timestamp
Tanvi Trivedi,"Swaroop Sampat: Satishji always motivated me to stay fit and happy, he was a good friend, not just co-actor","A Good Friend, Swaroop, Sampat, Satishji, Friend, Actor","Technology, International, Entertainment",https://timesofindia.indiatimes.com/tv/news/hindi/swaroop-sampat-satishji-always-motivated-me-to-stay-fit-and-happy-he-was-a-good-friend-not-just-co-actor/articleshow/124824456.cms,TOI,2025-10-26 19:51:11
TOI Sports Desk,Shockwaves in Pakistan cricket! PCB to sack national head coach after Women's World Cup disaster,"Pakistan, Pakistan Cricket, National Head Coach, Women'S World Cup Disaster, Shockwaves, Cricket, Head, Coach, Women, World","International, Sports",https://timesofindia.indiatimes.com/sports/cricket/icc-womens-world-cup-2025/shockwaves-in-pakistan-cricket-pcb-to-sack-national-head-coach-after-womens-world-cup-disaster/articleshow/124824406.cms,TOI,2025-10-26 19:51:11
Neeraj Dhankher,"Aries Weekly Shani Horoscope, October 27 â November 2, 2025: Saturn chills impulse buys, think twice and keep cash","Horoscope, Â, Weekly Shani Horoscope, Saturn Chills, Impulse Buys, Aries, Weekly, Shani, October, November",General,https://timesofindia.indiatimes.com/astrology/horoscope/aries-weekly-shani-horoscope-october-27-november-2-2025-saturn-chills-impulse-buys-think-twice-and-keep-cash/articleshow/124785761.cms,TOI,2025-10-26 19:51:11
TOI Sports Desk,Vladimir Kramnik on Daniel Naroditsky's tragic death: 'I was the only person in the chess community',"Vladimir Kramnik, Daniel Naroditsky'S, Daniel Naroditsky'S Tragic Death, The Only Person, The Chess Community, Vladimir, Kramnik, Daniel, Naroditsky, Death",General,https://timesofindia.indiatimes.com/sports/chess/vladimir-kramnik-on-daniel-naroditskys-tragic-death-i-was-the-only-person-in-the-chess-community/articleshow/124824389.cms,TOI,2025-10-26 19:51:11
TOI Tech Desk,"General Motors lays off hundreds of engineers on Microsoft Teams; says: It's not your performance, it'sâ¦","General Motors, ¦, Microsoft Teams, Your Performance, General, Motors, Hundreds, Engineers, Microsoft, Teams",Sports,https://timesofindia.indiatimes.com/technology/tech-news/general-motors-lays-off-hundreds-of-engineers-on-microsoft-teams-says-its-not-your-performance-its/articleshow/124824468.cms,TOI,2025-10-26 19:51:11
TOI Entertainment Desk,'This is such a non-issue': Kim Kardashian defends daughter North Westâs bold look,"Kim Kardashian, Daughter North, Issue, Kardashian, Daughter, North",General,https://timesofindia.indiatimes.com/entertainment/english/hollywood/news/this-is-such-a-non-issue-kim-kardashian-defends-daughter-north-wests-bold-look/articleshow/124824346.cms,TOI,2025-10-26 19:51:11
TOI World Desk,"Israel-Hamas conflict: Video shows bulldozers entering Gaza as Egyptian team searches for hostages, victims - watch","Israel, Gaza, Egyptian, Egyptian Team, Hamas, Conflict, Video, Bulldozers, Team, Hostages","Entertainment, Sports",https://timesofindia.indiatimes.com/world/middle-east/israel-hamas-conflict-video-shows-bulldozers-entering-gaza-as-egyptian-team-searches-for-hostages-victims-watch/articleshow/124824115.cms,TOI,2025-10-26 19:51:12
Jamal Ayub,"Dhanteras tragedy: Injured by carbide gun, it took 11-yr-old boy 5 long days to reach Bhopal for treatment","Dhanteras Tragedy:, Carbide Gun, 11-Yr-Old Boy, Dhanteras, Tragedy, Carbide, Days, Bhopal, Treatment",Health,https://timesofindia.indiatimes.com/city/bhopal/dhanteras-tragedy-injured-by-carbide-gun-it-took-11-yr-old-boy-5-long-days-to-reach-bhopal-for-treatment/articleshow/124824253.cms,TOI,2025-10-26 19:51:12
Bella Jaisinghani,Mumbai: City Catholics welcome new auxiliary bishop,"Mumbai, City Catholics, New Auxiliary Bishop, City, Catholics, Bishop",Technology,https://timesofindia.indiatimes.com/city/mumbai/mumbai-city-catholics-welcome-new-auxiliary-bishop/articleshow/124824548.cms,TOI,2025-10-26 19:51:13
TOI Sports Desk,'Aye slip rakh na': Harshit Rana thanks former India captain for his dream wicket at SCG,"India, Former India Captain, His Dream Wicket, Rakh, Harshit, Rana, Thanks, Captain, Dream, Wicket",Technology,https://timesofindia.indiatimes.com/sports/cricket/india-vs-australia/aye-slip-rakh-na-harshit-rana-thanks-former-india-captain-for-his-dream-wicket-at-scg/articleshow/124824610.cms,TOI,2025-10-26 19:51:13
TOI World Desk,Saudi gold prices hold steady amid online scam warnings: What you need to know,"Saudi, Saudi Gold Prices, Online Scam Warnings, Gold, Prices, Scam, Warnings",International,https://timesofindia.indiatimes.com/world/middle-east/saudi-gold-prices-hold-steady-amid-online-scam-warnings-what-you-need-to-know/articleshow/124824485.cms,TOI,2025-10-26 19:51:13
TOI Entertainment Desk,"OMEGA X Kevin talks about working in âMy Bias Is Showingâ, says âIt was my first time actingâ","Omega X Kevin, ÂIt, Omega X Kevin Talks, ÂMy Bias, My First Time, Omega, Kevin, Talks, Bias, Time",Entertainment,https://timesofindia.indiatimes.com/entertainment/k-pop/music/news/omega-x-kevin-talks-about-working-in-my-bias-is-showing-says-it-was-my-first-time-acting/articleshow/124823872.cms,TOI,2025-10-26 19:51:13
TOI Entertainment Desk,RJ Balaji seeks blessings at the Tiruchendur Murugan temple; Clarifies the 'Karuppu' and 'Mookuthi Amman 2â connection,"Rj Balaji, Karuppu, The Tiruchendur Murugan Temple, The 'Karuppu, 2Â Connection, Balaji, Blessings, Tiruchendur, Murugan, Temple",General,https://timesofindia.indiatimes.com/entertainment/tamil/movies/news/rj-balaji-seeks-blessings-at-the-tiruchendur-murugan-temple-clarifies-the-karuppu-and-mookuthi-amman-2-connection/articleshow/124824536.cms,TOI,2025-10-26 19:51:13
TOI Sports Desk,Rohit Sharmaâs coach reveals when he plans to retire,Coach,General,https://timesofindia.indiatimes.com/sports/cricket/india-vs-australia/rohit-sharmas-coach-reveals-when-he-plans-to-retire/articleshow/124824566.cms,TOI,2025-10-26 19:51:17
Neeraj Dhankher,"Taurus Weekly Shani Horoscope, October 27 â November 2, 2025: Saturn reopens old karma, apologize once, then move on","Horoscope, Â, Weekly Shani Horoscope, Old Karma, Taurus, Shani, October, November, Saturn, Karma",General,https://timesofindia.indiatimes.com/astrology/horoscope/taurus-weekly-shani-horoscope-october-27-november-2-2025-saturn-reopens-old-karma-apologize-once-then-move-on/articleshow/124785919.cms,TOI,2025-10-26 19:51:17
TOI Entertainment Desk,Deepika Padukone's fitness trainer recommends THESE 3 simple exercises at home for a toned and leaner back,"Deepika Padukone'S Fitness Trainer, These 3 Simple Exercises, Deepika, Padukone, Fitness, Trainer, Exercises, Home",Technology,https://timesofindia.indiatimes.com/entertainment/hindi/bollywood/news/deepika-padukones-fitness-trainer-recommends-these-3-simple-exercises-at-home-for-a-toned-and-leaner-back/articleshow/124824619.cms,TOI,2025-10-26 19:51:17
TOI Entertainment Desk,'He couldn't control his laughter': When late Satish Shah shared 1986 picture with 'Dear Friend' Farooq Shaikh,"His Laughter, Late Satish Shah, 1986 Picture, Dear Friend' Farooq Shaikh, Laughter, Satish, Shah, Picture, Friend, Farooq",Technology,https://timesofindia.indiatimes.com/entertainment/hindi/bollywood/news/he-couldnt-control-his-laughter-when-late-satish-shah-shared-1986-picture-with-dear-friend-farooq-shaikh/articleshow/124824708.cms,TOI,2025-10-26 19:51:18
Tanvi Trivedi,"Just a few days ago, Satishji said, âDonât worry I am going to live long': JD Majethia","Jd Majethia, Days, Satishji, Majethia",Technology,https://timesofindia.indiatimes.com/tv/news/hindi/just-a-few-days-ago-satishji-said-dont-worry-i-am-going-to-live-long-jd-majethia/articleshow/124824537.cms,TOI,2025-10-26 19:51:18
Edit Profile,Latest Tamil Movies | List of New Tamil Films Releases 2025 | eTimes,"Latest Tamil Movies, | List, New Tamil Films, 2025 |, Movies, List, Tamil, Films",Entertainment,https://timesofindia.indiatimes.com/entertainment/latest-new-movies/tamil-movies,TOI,2025-10-26 19:51:25
Edit Profile,Upcoming Kannada Movies 2025 | Kannada Movies Releasing This Week | eTimes,"Kannada, Upcoming Kannada Movies, 2025 | Kannada Movies, Movies, Week",Entertainment,https://timesofindia.indiatimes.com/entertainment/upcoming-movies/upcoming-kannada-movies,TOI,2025-10-26 19:51:25
Edit Profile,"Bollywood News, Latest Bollywood Gossip, Actresses, Actors, Movies, Films India | Entertainment - Times of India","India, Bollywood News, Latest Bollywood Gossip, Bollywood, News, Gossip, Actresses, Actors, Movies, Entertainment","Technology, Entertainment",https://timesofindia.indiatimes.com/entertainment/hindi/bollywood/news,TOI,2025-10-26 19:51:25
Edit Profile,Home Remedies | Medical Remedies Easily Available at Home,"Home Remedies, Medical Remedies, Home, Remedies","Technology, Health",https://timesofindia.indiatimes.com/life-style/health-fitness/home-remedies,TOI,2025-10-26 19:51:25
Edit Profile,Latest Hindi Movies | List of New Hindi Films Releases 2025 | eTimes,"Latest Hindi Movies, | List, New Hindi Films, 2025 |, Hindi, Movies, List, Films",Entertainment,https://timesofindia.indiatimes.com/entertainment/latest-new-movies/hindi-movies,TOI,2025-10-26 19:51:25
Edit Profile,"Tamil Cinema News: Kollywood News, Movies, Celebrities, Actresses, Actors, Films, Songs, Videos | Entertainment - Times of India","India, Tamil Cinema News, Kollywood News, | Entertainment - Times, Tamil, Cinema, News, Kollywood, Movies, Celebrities","Technology, Entertainment",https://timesofindia.indiatimes.com/entertainment/tamil/movies/news,TOI,2025-10-26 19:51:25
Edit Profile,Upcoming Malayalam Movies 2025 | Malayalam Movies Releasing This Week | eTimes,"Upcoming Malayalam Movies, Malayalam Movies, Movies, Week",Entertainment,https://timesofindia.indiatimes.com/entertainment/upcoming-movies/upcoming-malayalam-movies,TOI,2025-10-26 19:51:25
Edit Profile,"Mollywood News: Malayalam Cinema News, Movies, Celebrities, Actresses, Actors, Films, Songs, Videos | Entertainment - Times of India","India, Mollywood News, Malayalam Cinema News, | Entertainment - Times, Mollywood, News, Malayalam, Cinema, Movies, Celebrities","Technology, Entertainment",https://timesofindia.indiatimes.com/entertainment/malayalam/movies/news,TOI,2025-10-26 19:51:26
Edit Profile,"Latest news on Health, Medical Tips, Healthcare Articles – Times of India Lifestyle","Latest News, Medical Tips, Healthcare Articles, India Lifestyle, News, Health, Tips, Healthcare, Articles, Times",Health,https://timesofindia.indiatimes.com/life-style/health-fitness/health-news,TOI,2025-10-26 19:51:28
Edit Profile,"Telugu Cinema News (తెలుగు సినిమా న్యూస్): Tollywood News, Movies, Celebrities, Actresses, Actors, Films, Songs, Videos | Entertainment - Times of India","Tollywood News, India, Telugu Cinema News, (తెలుగు సినిమా న్యూస్, | Entertainment - Times, Telugu, Cinema, News, Tollywood, Movies","Technology, Entertainment",https://timesofindia.indiatimes.com/entertainment/telugu/movies/news,TOI,2025-10-26 19:51:28
TOI Lifestyle Desk,Pancreatic cancer: 4 warning signs in your legs that you shouldn't ignore,"Pancreatic Cancer, 4 Warning Signs, Your Legs, Cancer, Signs, Legs",International,https://timesofindia.indiatimes.com/life-style/health-fitness/health-news/pancreatic-cancer-4-warning-signs-in-your-legs-that-you-shouldnt-ignore/articleshow/124722369.cms,TOI,2025-10-26 19:51:31
TOI Tech Desk,"Apple iPhone 17 Pro is available for just Rs 70,155 on Amazon; know how to grab the deal","Apple, Apple Iphone, The Deal, Iphone, Amazon, Deal",Technology,https://timesofindia.indiatimes.com/technology/mobiles-tabs/apple-iphone-17-pro-is-available-for-just-rs-70155-on-amazon-know-how-to-grab-the-deal/articleshow/124811494.cms,TOI,2025-10-26 19:51:31
TOI Tech Desk,"Wordle today #1589: Hints and answers for todayâs Wordle (October 25, 2025)","TodayâS Wordle, Wordle, Today, Hints, Answers, October",General,https://timesofindia.indiatimes.com/technology/gaming/wordle-today-1589-hints-and-answers-for-todays-wordle-october-25-2025/articleshow/124798889.cms,TOI,2025-10-26 19:51:32
TOI Lifestyle Desk,Breakthrough in Cancer treatment: Scientists develop experiential âsuper vaccineâ with 'outstanding' results on cancerous mice,"Cancer Treatment, Experiential ÂSuper Vaccineâ, 'Outstanding' Results, Cancerous Mice, Breakthrough, Cancer, Treatment, Scientists, Results, Mice",Health,https://timesofindia.indiatimes.com/life-style/health-fitness/health-news/breakthrough-in-cancer-treatment-scientists-develop-experiential-super-vaccine-with-outstanding-results-on-cancerous-mice/articleshow/124824637.cms,TOI,2025-10-26 19:51:39
TOI Business Desk,Donald Trump at ASEAN: US and Malaysia sign major trade agreement; more deals from Indo-Pacific partners in process,"Donald Trump, Malaysia, Major Trade Agreement, More Deals, Indo-Pacific Partners, Donald, Trump, Asean, Trade, Agreement",Economy,https://timesofindia.indiatimes.com/business/international-business/donald-trump-at-asean-us-and-malaysia-sign-major-trade-agreement-more-deals-from-indo-pacific-partners-in-process/articleshow/124824403.cms,TOI,2025-10-26 19:51:39
TOI Lifestyle Desk,Janhvi Kapoorâs nostalgic Cavalli moment is a love letter to the boldness of 2000s fashion,"Janhvi KapoorâS, Nostalgic Cavalli Moment, A Love Letter, The Boldness, Janhvi, Cavalli, Moment, Love, Letter, Boldness",General,https://timesofindia.indiatimes.com/life-style/fashion/celeb-style/janhvi-kapoors-nostalgic-cavalli-moment-is-a-love-letter-to-the-boldness-of-2000s-fashion/articleshow/124824569.cms,TOI,2025-10-26 19:51:39
Shantanu Nandan Sharma,âI want to know what exactly happened on that day Zubeen Garg diedâ,"That Day, Zubeen, Garg",Technology,https://timesofindia.indiatimes.com/i-want-to-know-what-exactly-happened-on-that-day-zubeen-garg-died/articleshow/124824880.cms,TOI,2025-10-26 19:51:45
Barsha Dutta,Will Kyler Gordon play against the Baltimore Ravens today? Latest injury update on the Chicago Bears' cornerback,"Baltimore, Chicago, Will Kyler Gordon, The Baltimore Ravens, Latest Injury Update, The Chicago Bears' Cornerback, Gordon, Ravens, Today, Injury",Technology,https://timesofindia.indiatimes.com/sports/nfl/news/will-kyler-gordon-play-against-the-baltimore-ravens-today-latest-injury-update-on-the-chicago-bears-cornerback/articleshow/124822567.cms,TOI,2025-10-26 19:51:45
Sidhharrth S Kumaar,"Weekly Career Horoscope, October 26 to November 01, 2025: Success, challenges, and breakthroughs; Know about your Career","Horoscope, Weekly Career Horoscope, Your Career, Career, October, November, Success, Challenges, Breakthroughs",General,https://timesofindia.indiatimes.com/astrology/horoscope/weekly-career-horoscope-october-26-to-november-01-2025-success-challenges-and-breakthroughs-know-about-your-career/articleshow/124824814.cms,TOI,2025-10-26 19:51:45
TOI Sports Desk,"After sitting out Sydney ODI vs Australia, Arshdeep Singh shares âTruckaaan Vaaleâ post - Watch","Australia, Singh, ÂTruckaaan, , Arshdeep Singh Shares, Vaaleâ Post, Sydney, Shares, Post",General,https://timesofindia.indiatimes.com/sports/cricket/india-vs-australia/after-sitting-out-sydney-odi-vs-australia-arshdeep-singh-shares-truckaaan-vaale-post-watch/articleshow/124824608.cms,TOI,2025-10-26 19:51:45
TOI Sports Desk,1st ODI: Harry Brook's heroics in vain as New Zealand beat England,"Harry Brook'S, New Zealand, England, 1St Odi, Harry Brook'S Heroics, New Zealand Beat England, Harry, Brook, Heroics, Zealand",Technology,https://timesofindia.indiatimes.com/sports/cricket/news/1st-odi-harry-brook-smashes-11-sixes-135-runs-to-star-in-england-rout-of-new-zealand/articleshow/124824998.cms,TOI,2025-10-26 19:51:45
TOI Education,India's medical colleges see more than double growth in last 11 years: How aspiring doctors can benefit from new opportunities,"India, India'S Medical Colleges, More Than Double Growth, Last 11 Years, How Aspiring Doctors, New Opportunities, Colleges, Growth, Years, Doctors","Health, Education",https://timesofindia.indiatimes.com/education/news/indias-medical-colleges-see-more-than-double-growth-in-last-11-years-how-aspiring-doctors-can-benefit-from-new-opportunities/articleshow/124822954.cms,TOI,2025-10-26 19:51:46
TOI Tech Desk,Elon Musk on Grok kids mode: Has same settings that companies want forâ¦,"¦, Elon Musk, Grok Kids Mode, Same Settings, Elon, Musk, Grok, Kids, Mode, Settings",General,https://timesofindia.indiatimes.com/technology/tech-news/elon-musk-on-grok-kids-mode-has-same-settings-that-companies-want-for/articleshow/124824712.cms,TOI,2025-10-26 19:51:46
TOI Entertainment Desk,"Dhruv Vikram not to be compared to Vikram, Pasupathi shares his support for the 'Bison' actor","Dhruv Vikram, His Support, The 'Bison' Actor, Dhruv, Vikram, Pasupathi, Support, Bison, Actor",Entertainment,https://timesofindia.indiatimes.com/entertainment/tamil/movies/news/dhruv-vikram-not-to-be-compared-to-vikram-pasupathi-shares-his-support-for-the-bison-actor/articleshow/124824850.cms,TOI,2025-10-26 19:51:46
TOI Tech Desk,"As Reliance, Meta announce Rs 855 crore AI partnership; RIL clarifies that the transaction does not ...","Meta Announce, 855 Crore Ai Partnership, The Transaction, Reliance, Announce, Crore, Partnership, Clarifies, Transaction",Technology,https://timesofindia.indiatimes.com/technology/tech-news/as-reliance-meta-announce-rs-855-crore-ai-partnership-ril-clarifies-that-the-transaction-does-not-/articleshow/124824940.cms,TOI,2025-10-26 19:51:46
TOI Entertainment Desk,"Kareena Kapoor Khan drops stunning vacay PICS featuring Saif Ali Khan, Taimur, Katrina Kaif reacts, netizens call her a 'queen'","Kareena, Khan, Ali Khan, Katrina Kaif, Kareena Kapoor Khan, Stunning Vacay Pics, A 'Queen, Kapoor, Vacay, Pics",Technology,https://timesofindia.indiatimes.com/entertainment/hindi/bollywood/news/kareena-kapoor-khan-drops-stunning-vacay-pics-featuring-saif-ali-khan-taimur-katrina-kaif-reacts-netizens-call-her-a-queen/articleshow/124824999.cms,TOI,2025-10-26 19:51:46
TOI World Desk,'Not at India's expense': US state secretary Marco Rubio's big remark on US-Pakistan ties - what he said,"India, Marco Rubio, India'S Expense, Us-Pakistan Ties, Expense, State, Secretary, Marco, Rubio, Remark",Technology,https://timesofindia.indiatimes.com/world/us/not-at-indias-expense-us-state-secretary-marco-rubios-big-remark-on-us-pakistan-ties-what-he-said/articleshow/124824245.cms,TOI,2025-10-26 19:51:47
Samdani MN,VVITU Balotsva: Stage set for children global cultural festival,"Vvitu Balotsva, Children Global Cultural Festival, Vvitu, Balotsva, Stage, Children, Festival",International,https://timesofindia.indiatimes.com/city/vijayawada/vvitu-balotsva-stage-set-for-children-global-cultural-festival/articleshow/124825033.cms,TOI,2025-10-26 19:51:47
Korean Wave,The Times of India,"The Times Of India, The Times, Times, India",General,https://timesofindia.indiatimes.com/,TOI,2025-10-26 21:44:30
Tilak Devasher,End Of Pakistanâs âStrategic Depthâ,PakistanâS ÂStrategic Depthâ,General,https://timesofindia.indiatimes.com/end-of-pakistans-strategic-depth/articleshow/124829538.cms,TOI,2025-10-26 21:44:33
TOI World Desk,From Nixonâs bowling alley to Trumpâs ballroom: Timeline of 10 major White House renovations,"White House, Bowling Alley, Bowling, Alley, Ballroom, Timeline, White, House, Renovations",General,https://timesofindia.indiatimes.com/world/us/from-nixons-bowling-alley-to-trumps-ballroom-timeline-of-10-major-white-house-renovations/articleshow/124828784.cms,TOI,2025-10-26 21:44:33
Sehjal Gupta,Bollywood actor faces unexpected moment as Khabib Nurmagomedov avoids selfie request during UFC 321 fan chaos,"Khabib Nurmagomedov, Selfie, Bollywood Actor, Unexpected Moment, Selfie Request, Ufc 321 Fan Chaos, Bollywood, Actor, Moment, Khabib",Entertainment,https://timesofindia.indiatimes.com/sports/international-sports/varun-dhawan-faces-unexpected-moment-as-khabib-nurmagomedov-avoids-selfie-request-during-ufc-321-fan-chaos/articleshow/124829479.cms,TOI,2025-10-26 21:44:33
TOI Sports Desk,'There was no communication': Ajinkya Rahane's strong message to selectors; says India needed him in Australia,"India, Australia, No Communication, Ajinkya Rahane'S Strong Message, Communication, Ajinkya, Rahane, Message, Selectors",General,https://timesofindia.indiatimes.com/sports/cricket/news/there-was-no-communication-ajinkya-rahanes-strong-message-to-selectors-after-big-ranji-hundred/articleshow/124829519.cms,TOI,2025-10-26 21:44:33
TOI Business Desk,"Bank jobs surge: SBI plans 3,500 officer recruitments this year; targets 30% workforce for women","Bank Jobs, 3,500 Officer Recruitments, 30% Workforce, Bank, Jobs, Officer, Recruitments, Year, Targets, Workforce",Economy,https://timesofindia.indiatimes.com/business/india-business/bank-jobs-surge-sbi-plans-3500-officer-recruitments-this-year-targets-30-workforce-for-women/articleshow/124829310.cms,TOI,2025-10-26 21:44:33
Global Sports Desk,IShowSpeedâs Fortnite early stream scores perfect 10/10 on IMDb and fans are loving every moment,"IshowspeedâS Fortnite, Fortnite Early Stream Scores, Stream, Scores, Imdb, Fans, Moment",Entertainment,https://timesofindia.indiatimes.com/world/us-streamers/ishowspeeds-fortnite-early-stream-scores-perfect-10-on-imdb-and-fans-are-loving-every-moment/articleshow/124829622.cms,TOI,2025-10-26 21:44:33
TOI World Desk,No dual citizens in US Congress: Republican leader's new bill in 'America First' push,"Congress, Republican, No Dual Citizens, Republican Leader'S New Bill, America First, Citizens, Leader, Bill, America, Push",Politics,https://timesofindia.indiatimes.com/world/us/no-dual-citizens-in-us-congress-republican-leaders-new-bill-in-america-first-push/articleshow/124829573.cms,TOI,2025-10-26 21:44:33
Lubna Kably,Flying into the US? You will be photographed and entered into a facial recognition database,"A Facial Recognition Database, Recognition, Database",General,https://timesofindia.indiatimes.com/world/us/flying-into-the-us-you-will-be-photographed-and-entered-into-a-facial-recognition-database/articleshow/124825351.cms,TOI,2025-10-26 21:44:33
Sehjal Gupta,Ben Baderâs stepsister Toria Aronoff Schottenstein honors âgentleâ YouTuber after his unexpected sauna accident death,"Ben BaderâS, ÂGentleâ Youtuber, Stepsister, Toria, Aronoff, Schottenstein, Youtuber, Accident, Death",General,https://timesofindia.indiatimes.com/world/us-streamers/ben-baders-stepsister-toria-aronoff-schottenstein-honors-gentle-youtuber-after-his-unexpected-sauna-accident-death/articleshow/124829335.cms,TOI,2025-10-26 21:44:33
TOI World Desk,"âNo king, no godâ: Young artist Earth to Eve aims at Donald Trump with a razor-sharp anthem","Donald Trump, ÂNo King, No Godâ, Young Artist Earth, A Razor-Sharp Anthem, King, Artist, Earth, Aims, Donald",Technology,https://timesofindia.indiatimes.com/world/us/no-king-no-god-young-artist-earth-to-eve-aims-at-donald-trump-with-a-razor-sharp-anthem/articleshow/124829355.cms,TOI,2025-10-26 21:44:33
TOI Entertainment Desk,'We don't stage grief': Ishitta Arun hits back at trolls for laughing at Piyush Pandeyâs funeral,"Grief, Ishitta, Arun, Trolls, Piyush, Funeral",General,https://timesofindia.indiatimes.com/entertainment/hindi/bollywood/news/we-dont-stage-grief-ishitta-arun-hits-back-at-trolls-for-laughing-at-piyush-pandeys-funeral/articleshow/124829531.cms,TOI,2025-10-26 21:44:33
TOI World Desk,'Pregnant with 83 children': What Albanese PM Rama said about worldâs 1st AI minister - watch,"83 Children, Albanese Pm Rama, WorldâS 1St, Minister - Watch, Children, Albanese, Rama, Minister, Watch","Politics, International, Technology",https://timesofindia.indiatimes.com/world/europe/pregnant-with-83-children-what-albanese-pm-rama-said-about-worlds-1st-ai-minister-watch/articleshow/124829423.cms,TOI,2025-10-26 21:44:33
Bhupender Yadav,"âClimate Justice Has A Fair Price Tag Of Trillions, Not Billionsâ","ÂClimate, A Fair Price Tag, Justice, Price, Trillions","Technology, Environment, Crime",https://timesofindia.indiatimes.com/climate-justice-has-a-fair-price-tag-of-trillions-not-billions/articleshow/124829657.cms,TOI,2025-10-26 21:44:35
TOI Lifestyle Desk,The one symptom of colon cancer everyone is missing,"The One Symptom, Colon Cancer, Symptom, Colon, Cancer",General,https://timesofindia.indiatimes.com/life-style/health-fitness/health-news/the-one-symptom-of-colon-cancer-everyone-is-missing/articleshow/124829753.cms,TOI,2025-10-26 21:44:36
TOI Entertainment Desk,Satish Shah on choosing Jaane Bhi Do Yaaro: 'I was a beggar then; I couldnât be a chooser...',"Satish, Jaane Bhi, A Chooser, Shah, Jaane, Chooser",General,https://timesofindia.indiatimes.com/entertainment/hindi/bollywood/news/satish-shah-on-choosing-jaane-bhi-do-yaaro-i-was-a-beggar-then-i-couldnt-be-a-chooser-/articleshow/124829808.cms,TOI,2025-10-26 21:44:36
Chidanand Rajghatta,"Ties with Pakistan not at India's expense, says Marco Rubio -- even though it is","Pakistan, India, Marco Rubio, India'S Expense, Ties, Expense, Marco, Rubio",General,https://timesofindia.indiatimes.com/world/us/ties-with-pakistan-not-at-indias-expense-says-marco-rubio-even-though-it-is-us-trump/articleshow/124829642.cms,TOI,2025-10-26 21:44:36
