Author,Headline,Keywords,Topics,URL,Outlet,Timestamp
Premendra Mishra,Millennium-old Deo sun temple ready to welcome 15L devotees,"Millennium-Old Deo Sun Temple, 15L Devotees, Millennium, Temple, Devotees",Politics,https://timesofindia.indiatimes.com/city/patna/millennium-old-deo-sun-temple-ready-to-welcome-15l-devotees/articleshow/124827188.cms,TOI,2025-10-26 21:45:25
TOI Entertainment Desk,Anubhav Sinha reminisces about making âRa.Oneâ with Shah Rukh Khan; Celebrates 14 years of the sci-fi blockbuster,"Khan, Anubhav Sinha, Shah Rukh Khan, 14 Years, The Sci-Fi Blockbuster, Anubhav, Sinha, Shah, Rukh, Years",General,https://timesofindia.indiatimes.com/entertainment/hindi/bollywood/news/anubhav-sinha-reminisces-about-making-ra-one-with-shah-rukh-khan-celebrates-14-years-of-the-sci-fi-blockbuster/articleshow/124827099.cms,TOI,2025-10-26 21:45:25
TOI Entertainment Desk,âAise Mat Karoâ: Govindaâs daughter Tina Ahuja asks fans to stop comparing Yashvardhan to Ahaan Panday,"Karoâ, Daughter Tina, Daughter Tina Ahuja, Daughter, Tina, Ahuja, Fans, Yashvardhan, Ahaan, Panday",Technology,https://timesofindia.indiatimes.com/entertainment/hindi/bollywood/news/aise-mat-karo-govindas-daughter-tina-ahuja-asks-fans-to-stop-comparing-yashvardhan-to-ahaan-panday/articleshow/124827057.cms,TOI,2025-10-26 21:45:25
TOI Lifestyle Desk,"Optical illusion personality test: Elephant or mouse? The animal you spot first reveals your strengths, weaknesses, and how to balance them","Optical Illusion Personality Test, The Animal, Your Strengths, Illusion, Personality, Test, Elephant, Mouse, Animal, Strengths",General,https://timesofindia.indiatimes.com/life-style/relationships/work/optical-illusion-personality-test-elephant-or-mouse-the-animal-you-spot-first-reveals-your-strengths-weaknesses-and-how-to-balance-them/articleshow/124827070.cms,TOI,2025-10-26 21:45:25
TOI World Desk,NYC mayoral race: Faith leaders representing over 150 congregations back Andrew Cuomo,"Nyc Mayoral, Andrew Cuomo, Nyc Mayoral Race, Faith Leaders, Over 150 Congregations, Race, Faith, Leaders, Congregations, Andrew",Technology,https://timesofindia.indiatimes.com/world/us/nyc-mayoral-race-faith-leaders-representing-over-150-congregations-back-andrew-cuomo/articleshow/124824943.cms,TOI,2025-10-26 21:45:25
Global Sports Desk,Dana White breaks silence on Tom Aspinall vs Ciryl Gane no contest after eye poke at UFC 321,"Dana White, Tom Aspinall, Ciryl Gane, No Contest, Eye Poke, Dana, White, Silence, Aspinall, Ciryl",General,https://timesofindia.indiatimes.com/sports/international-sports/dana-white-breaks-silence-on-tom-aspinall-vs-ciryl-gane-no-contest-after-eye-poke-at-ufc-321/articleshow/124827176.cms,TOI,2025-10-26 21:45:25
Sanjay Sharma,MPESB MP Police Constable Admit Card 2025 released: Download hall ticket PDF at esb.mp.gov.in,"Police Constable Admit Card, Download Hall Ticket Pdf, Mpesb, Police, Constable, Admit, Card, Download, Hall, Ticket",Crime,https://timesofindia.indiatimes.com/education/news/mpesb-mp-police-constable-admit-card-2025-released-download-hall-ticket-pdf-at-esb-mp-gov-in/articleshow/124827168.cms,TOI,2025-10-26 21:45:25
TOI Education,"Federal taxes will not apply to student loans forgiven in 2025 in US, offering relief to millions of borrowers","Us, Federal Taxes, Student Loans, Taxes, Student, Loans, Relief, Millions, Borrowers","Technology, Education",https://timesofindia.indiatimes.com/education/news/federal-taxes-will-not-apply-to-student-loans-forgiven-in-2025-in-us-offering-relief-to-millions-of-borrowers/articleshow/124824068.cms,TOI,2025-10-26 21:45:25
TOI World Desk,'Will defend ourselves': Netanyahu says Israel needs 'no approval' to strike foes; claims veto on Gaza force members,"Netanyahu, Israel, Gaza, 'No Approval, Gaza Force Members, Approval, Foes, Claims, Veto, Force",Technology,https://timesofindia.indiatimes.com/world/middle-east/will-defend-ourselves-netanyahu-says-israel-needs-no-approval-to-strike-foes-claims-veto-on-gaza-force-members/articleshow/124827158.cms,TOI,2025-10-26 21:45:27
TOI Entertainment Desk,Krushna Abhishek dances to âKhaike Paan Banaras Walaâ; Calls performing before Big B his â100 crore momentâ,"Krushna Abhishek, Paan Banaras Walaâ, Big B, Krushna, Abhishek, Paan, Banaras, Calls, Crore",Technology,https://timesofindia.indiatimes.com/entertainment/hindi/bollywood/news/krushna-abhishek-dances-to-khaike-paan-banaras-wala-calls-performing-before-big-b-his-100-crore-moment/articleshow/124827229.cms,TOI,2025-10-26 21:45:27
TOI News Desk,"Evening news wrap: PM Modi says 21st century belongs to India-Asean, Army on high alert ahead of cyclone 'Montha' & more","India, 21St Century, High Alert, Cyclone 'Montha, Evening, News, Wrap, Century, Asean, Army",General,https://timesofindia.indiatimes.com/india/evening-news-wrap-pm-modi-says-21st-century-belongs-to-india-asean-army-on-high-alert-ahead-of-cyclone-montha-more/articleshow/124827136.cms,TOI,2025-10-26 21:45:27
TOI News Desk,'Birth-based ruling class': Dynasts lead candidate lists in Bihar elections; old families still call the shots,"Bihar, 'Birth-Based Ruling Class, Candidate Lists, Bihar Elections, Old Families, The Shots, Birth, Class, Dynasts, Candidate",Politics,https://timesofindia.indiatimes.com/india/birth-based-ruling-class-dynasts-lead-candidate-lists-in-bihar-elections-old-families-still-call-the-shots/articleshow/124827140.cms,TOI,2025-10-26 21:45:27
Satyanarayan Pattnaik,Prime Minister Modi praises Koraput Coffee in Mann Ki Baat radio address,"Mann Ki Baat, Prime Minister, Koraput Coffee, Prime, Minister, Koraput, Coffee, Mann, Baat, Radio","Politics, Technology",https://timesofindia.indiatimes.com/city/bhubaneswar/prime-minister-modi-praises-koraput-coffee-in-mann-ki-baat-radio-address/articleshow/124827237.cms,TOI,2025-10-26 21:45:27
TOI Tech Desk,Apple may soon make it easier for iPhone users to upload photos to third-party apps,"Apple, Iphone Users, Third-Party Apps, Users, Photos, Party, Apps",Technology,https://timesofindia.indiatimes.com/technology/mobiles-tabs/apple-may-soon-make-it-easier-for-iphone-users-to-upload-photos-to-third-party-apps/articleshow/124826990.cms,TOI,2025-10-26 21:45:29
TOI Lifestyle Desk,20-minute daily walk vs â¹10 lakh home gym: Cardiologist explains what really keeps your heart healthy,"Â¹10 Lakh Home Gym, Your Heart, Minute, Walk, Lakh, Home, Cardiologist, Heart","Technology, Health",https://timesofindia.indiatimes.com/life-style/health-fitness/fitness/20-minute-daily-walk-vs-10-lakh-home-gym-cardiologist-explains-what-really-keeps-your-heart-healthy/articleshow/124826623.cms,TOI,2025-10-26 21:45:29
TOI Business Desk,"India-EU FTA push: Piyush Goyal to visit Brussels to boost negotiations; focus on market access, duties, IP rights","Brussels, Piyush Goyal, Market Access, India, Push, Piyush, Goyal, Negotiations, Market, Access",Economy,https://timesofindia.indiatimes.com/business/india-business/india-eu-fta-push-piyush-goyal-to-visit-brussels-to-boost-negotiations-focus-on-market-access-duties-ip-rights/articleshow/124826905.cms,TOI,2025-10-26 21:45:29
